{
  "schema_version": "0.1",
  "case_id": "apartment-night-delivery",
  "title": "공동주택 심야 물류 하역 공간의 제도 사각지대",
  "status": "review",
  "jurisdiction": {
    "country": "KR",
    "region": null,
    "locality": null
  },
  "original_statement": "오래된 아파트는 심야에 모든 주차면이 차 있어 새벽 배송 차량이 도로와 회차 공간을 막는다. 물류 노동자는 짐을 멀리 옮겨야 하고, 입주민의 통행과 안전에도 문제가 생긴다. 공동주택에 한정해 비어 있는 장애인 전용 주차구역을 심야 5~10분 하역에 사용할 수 있는 예외를 사회적으로 논의하고 싶다.",
  "problem_definition": "심야에 주차면이 포화된 기존 공동주택에서 배송 차량이 합법적이고 안전하게 짧은 하역을 수행할 공간이 없어 물류 노동자의 작업 부담, 입주민 통행, 회차·소방 안전이 충돌한다.",
  "desired_change": "장애인 이동권을 훼손하지 않으면서 공동주택 심야 하역의 안전한 공간과 운영 규칙을 마련하기 위한 교차 상임위·부처 공동 검토 및 제한적 시범 설계를 요청한다.",
  "claims": [
    {
      "claim_id": "claim-observation-001",
      "text": "일부 기존 공동주택에서는 심야에 일반 주차면이 가득 차 배송 차량이 도로 또는 회차 공간에 정차한다.",
      "type": "observation",
      "origin": "user_observation",
      "source_ids": [],
      "contradicting_source_ids": [],
      "confidence": "unverified",
      "verified_at": null,
      "use_in_proposal": true,
      "notes": "사용자 관찰이며 빈도와 규모는 추가 조사 필요"
    },
    {
      "claim_id": "claim-fact-001",
      "text": "장애인등편의법 제17조제4항은 장애인전용주차구역 주차표지가 없는 자동차의 주차를 금지하고, 표지가 있어도 보행에 장애가 있는 사람이 탑승하지 않은 경우를 금지한다.",
      "type": "fact",
      "origin": "external_source",
      "source_ids": [
        "source-law-001"
      ],
      "contradicting_source_ids": [],
      "confidence": "high",
      "verified_at": "2026-08-27T03:00:00.000Z",
      "use_in_proposal": true,
      "notes": ""
    },
    {
      "claim_id": "claim-fact-002",
      "text": "보건복지부의 장애인전용주차구역 안내는 주차 가능 대상을 주차표지를 부착하고 보행에 장애가 있는 사람이 탑승한 차량으로 설명한다.",
      "type": "fact",
      "origin": "external_source",
      "source_ids": [
        "source-mohw-001"
      ],
      "contradicting_source_ids": [],
      "confidence": "high",
      "verified_at": "2026-08-27T03:00:00.000Z",
      "use_in_proposal": true,
      "notes": ""
    },
    {
      "claim_id": "claim-fact-003",
      "text": "장애인전용주차구역 위반과 주차 방해 행위의 단속·과태료 집행에는 지방자치단체 등 시설주관기관이 관여한다.",
      "type": "fact",
      "origin": "external_source",
      "source_ids": [
        "source-mohw-001",
        "source-law-001"
      ],
      "contradicting_source_ids": [],
      "confidence": "high",
      "verified_at": "2026-08-27T03:00:00.000Z",
      "use_in_proposal": true,
      "notes": ""
    },
    {
      "claim_id": "claim-fact-004",
      "text": "공동주택 주차 공간의 설치 기준은 주택·주차 관련 법령과 지방자치단체 조례의 적용을 받는다.",
      "type": "fact",
      "origin": "external_source",
      "source_ids": [
        "source-housing-001"
      ],
      "contradicting_source_ids": [],
      "confidence": "medium",
      "verified_at": "2026-08-27T03:00:00.000Z",
      "use_in_proposal": true,
      "notes": "구체 기준은 건축 시기·규모·지역 조례에 따라 별도 확인 필요"
    },
    {
      "claim_id": "claim-inference-001",
      "text": "공동주택 내부 합의만으로 장애인전용주차구역의 법률상 금지를 일반 배송 차량에 대해 면제하기는 어렵고, 예외를 도입하려면 법률 또는 명시적 위임 근거의 검토가 필요하다.",
      "type": "inference",
      "origin": "agent_analysis",
      "source_ids": [
        "source-law-001",
        "source-mohw-001"
      ],
      "contradicting_source_ids": [],
      "confidence": "medium",
      "verified_at": "2026-08-27T03:00:00.000Z",
      "use_in_proposal": true,
      "notes": "법률 전문가와 관계 부처의 확인 필요"
    },
    {
      "claim_id": "claim-inference-002",
      "text": "이 문제는 장애인 이동권, 공동주택·주차 인프라, 물류 노동 안전, 지방 집행 권한이 교차하는 사안이다.",
      "type": "inference",
      "origin": "agent_analysis",
      "source_ids": [
        "source-law-001",
        "source-housing-001",
        "source-assembly-001"
      ],
      "contradicting_source_ids": [],
      "confidence": "medium",
      "verified_at": "2026-08-27T03:00:00.000Z",
      "use_in_proposal": true,
      "notes": ""
    },
    {
      "claim_id": "claim-proposal-001",
      "text": "즉시 전국 예외를 도입하기보다 권리 보호 장치와 중단 조건을 둔 공동 검토 또는 시범사업을 우선 논의한다.",
      "type": "proposal",
      "origin": "user_proposal",
      "source_ids": [],
      "contradicting_source_ids": [],
      "confidence": "unverified",
      "verified_at": null,
      "use_in_proposal": true,
      "notes": ""
    }
  ],
  "sources": [
    {
      "source_id": "source-law-001",
      "title": "장애인·노인·임산부 등의 편의증진 보장에 관한 법률 제17조",
      "publisher": "국가법령정보센터",
      "source_type": "law",
      "official": true,
      "locator": "https://www.law.go.kr/DRF/lawService.do?ID=265737&OC=unicpla&mobileYn=Y&target=decc&type=HTML",
      "published_at": null,
      "checked_at": "2026-08-27T03:00:00.000Z",
      "effective_at": "현행 조문은 실제 사용 시 재검증",
      "summary": "장애인전용주차구역 설치, 표지, 주차 금지, 방해 금지, 단속과 하위법령 위임 구조",
      "supports": [
        "claim-fact-001",
        "claim-fact-003",
        "claim-inference-001",
        "claim-inference-002"
      ],
      "contradicts": [],
      "confidence": "high",
      "snapshot_hash": null,
      "notes": "예제이므로 발송 전 국가법령정보센터 현행 조문 재확인"
    },
    {
      "source_id": "source-mohw-001",
      "title": "장애인편의시설관련정책 — 장애인전용주차구역",
      "publisher": "보건복지부",
      "source_type": "government",
      "official": true,
      "locator": "https://www.mohw.go.kr/menu.es?mid=a10710020500",
      "published_at": null,
      "checked_at": "2026-08-27T03:00:00.000Z",
      "effective_at": "웹 안내 확인일 기준",
      "summary": "주차 가능 차량, 단속 대상, 시설주관기관과 과태료 안내",
      "supports": [
        "claim-fact-002",
        "claim-fact-003",
        "claim-inference-001"
      ],
      "contradicts": [],
      "confidence": "high",
      "snapshot_hash": null,
      "notes": ""
    },
    {
      "source_id": "source-housing-001",
      "title": "주택건설기준 등에 관한 규정 및 관련 주차 기준",
      "publisher": "국가법령정보센터",
      "source_type": "law",
      "official": true,
      "locator": "https://www.law.go.kr/법령/주택건설기준등에관한규정",
      "published_at": null,
      "checked_at": "2026-08-27T03:00:00.000Z",
      "effective_at": "건축 시기와 지역 조례별 확인 필요",
      "summary": "공동주택 시설·주차 설치 기준의 법령 계층을 확인하기 위한 공식 원문 진입점",
      "supports": [
        "claim-fact-004",
        "claim-inference-002"
      ],
      "contradicts": [],
      "confidence": "medium",
      "snapshot_hash": null,
      "notes": "정책 제안서 최종본에는 적용 대상 단지의 준공시기와 조례를 추가 조사"
    },
    {
      "source_id": "source-assembly-001",
      "title": "대한민국 국회 위원회 및 의안 공식 자료",
      "publisher": "대한민국 국회",
      "source_type": "assembly",
      "official": true,
      "locator": "https://www.assembly.go.kr/portal/main/main.do",
      "published_at": null,
      "checked_at": "2026-08-27T03:00:00.000Z",
      "effective_at": "위원회 구성은 발송 직전 재검증",
      "summary": "보건복지·국토교통·기후에너지환경노동 관련 위원회의 현재 명칭과 구성 확인 경로",
      "supports": [
        "claim-inference-002"
      ],
      "contradicts": [],
      "confidence": "medium",
      "snapshot_hash": null,
      "notes": "예제에는 현직 의원 이름을 고정하지 않음"
    }
  ],
  "legal_layers": [
    {
      "layer_id": "layer-law-disabled-parking",
      "level": "law",
      "instrument": "장애인·노인·임산부 등의 편의증진 보장에 관한 법률 제17조",
      "current_rule": "주차표지와 보행장애인 탑승 요건을 충족하지 않은 차량의 장애인전용주차구역 주차를 금지한다.",
      "change_path": "일반 배송 차량의 심야·단시간 예외를 허용하려면 법률상 예외 또는 하위법령에 대한 명확한 위임 여부를 국회와 정부가 검토해야 한다.",
      "decision_maker": "국회, 법률 위임 범위 안의 정부",
      "source_ids": [
        "source-law-001"
      ],
      "certainty": "confirmed"
    },
    {
      "layer_id": "layer-decree-enforcement",
      "level": "presidential_decree",
      "instrument": "장애인등편의법 시행령·시행규칙",
      "current_rule": "주차표지, 주차 방해 행위, 설치·표지 등 세부 기준을 정한다.",
      "change_path": "법률이 허용하거나 위임한 범위 안에서 세부 시간·대상·단속·기록 조건을 설계할 수 있는지 검토한다.",
      "decision_maker": "정부 및 주무부처",
      "source_ids": [
        "source-law-001",
        "source-mohw-001"
      ],
      "certainty": "needs_legal_review"
    },
    {
      "layer_id": "layer-local-parking",
      "level": "local_ordinance",
      "instrument": "지방자치단체 주차장·공동주택 관련 조례",
      "current_rule": "법령의 위임 범위에서 주차 설치와 운영 기준을 구체화한다.",
      "change_path": "하역 공간 시범사업, 표지, 단속·평가 기준 등 상위법에 반하지 않는 운영 개선을 검토한다.",
      "decision_maker": "지방의회와 지방자치단체",
      "source_ids": [
        "source-housing-001"
      ],
      "certainty": "needs_legal_review"
    },
    {
      "layer_id": "layer-management-rule",
      "level": "management_rule",
      "instrument": "공동주택 관리규약과 주차 운영규칙",
      "current_rule": "단지 내부 일반 주차·회차·출입·하역 운영을 정할 수 있으나 상위법상 장애인전용주차구역 금지를 면제할 수는 없다.",
      "change_path": "일반 하역 지점, 예약·표지, 카트 보관, 회차공간 안전관리 등 합법 범위의 운영안을 도입한다.",
      "decision_maker": "입주자대표회의와 관리주체",
      "source_ids": [
        "source-law-001",
        "source-housing-001"
      ],
      "certainty": "needs_legal_review"
    },
    {
      "layer_id": "layer-platform-policy",
      "level": "private_policy",
      "instrument": "택배사·배송 플랫폼의 노선·장비·도착시간 운영방침",
      "current_rule": "배송 사업자가 차량·기사·장비·노선 운영을 결정한다.",
      "change_path": "전동 카트, 공동 환적, 도착시간 조정, 관리사무소 사전 통지 등을 사업자 운영정책으로 시험한다.",
      "decision_maker": "택배사와 배송 플랫폼",
      "source_ids": [],
      "certainty": "hypothesis"
    }
  ],
  "authorities": [
    {
      "authority_id": "authority-na-health",
      "organization": "국회 보건복지위원회",
      "authority_type": "legislature",
      "action": "legislate",
      "jurisdiction_type": "direct",
      "reason": "장애인전용주차구역의 법적 보호와 예외 근거가 핵심 쟁점이다.",
      "source_ids": [
        "source-law-001",
        "source-assembly-001"
      ]
    },
    {
      "authority_id": "authority-mohw",
      "organization": "보건복지부",
      "authority_type": "central_government",
      "action": "regulate",
      "jurisdiction_type": "direct",
      "reason": "장애인전용주차구역 정책과 하위기준, 이동권 보호를 담당한다.",
      "source_ids": [
        "source-mohw-001"
      ]
    },
    {
      "authority_id": "authority-na-land",
      "organization": "국회 국토교통위원회",
      "authority_type": "legislature",
      "action": "convene",
      "jurisdiction_type": "joint",
      "reason": "공동주택·주차 인프라와 신축·대수선 기준을 함께 검토해야 한다.",
      "source_ids": [
        "source-housing-001",
        "source-assembly-001"
      ]
    },
    {
      "authority_id": "authority-molit",
      "organization": "국토교통부",